{
  "$schema": "./schemas/prospective.schema.json",
  "pageTitle": "2026年度 新歓のお知らせ",
  "intro": "慶應義塾體育會ゴルフ部では、2026年度の新入部員を募集しております。ゴルフ経験者はもちろん、大学からゴルフを始めたい方のご参加も歓迎いたします。",
  "orientationSession": {
    "date": "2026年4月4日土曜日",
    "startTime": "18:00",
    "endTime": "19:00",
    "format": "オンライン"
  },
  "line": {
    "accountName": "慶應義塾體育會ゴルフ部男子",
    "id": "@882fmofb",
    "deadline": "4月3日金曜日"
  },
  "requiredFields": [
    "学部",
    "学年",
    "氏名",
    "出身高校",
    "ゴルフ歴",
    "ベストスコア",
    "説明会への参加可否"
  ],
  "mandatoryNote": "なお、入部を希望される方は入部説明会への参加が必須となります。やむを得ず説明会に参加できない場合は、別日程での対応を検討いたしますので、その旨を必ずご連絡ください。",
  "formNote": "※説明会のZoom URLは、LINE公式アカウントを通じてご案内いたします。",
  "timelineHeading": "入部までの流れ",
  "timeline": [
    {
      "label": "LINE公式アカウントへの情報送信期限",
      "date": "2026年4月3日金曜日"
    },
    {
      "label": "入部説明会（オンライン）",
      "date": "2026年4月4日土曜日",
      "time": "18:00〜19:00"
    },
    {
      "label": "新入生トレーニング",
      "date": "2026年4月6日月曜日〜4月22日水曜日",
      "time": "6:00〜9:00",
      "note": "期間中に面談を実施いたします。"
    },
    {
      "label": "入部",
      "date": "2026年4月25日土曜日"
    }
  ],
  "closing": "ご不明点やご質問等がございましたら、LINE公式アカウントまたはInstagramのDMよりお気軽にお問い合わせください。"
}
